{
  "schema_version": "1.0",
  "note": "theorem-h-orientation",
  "title": "Theorem H for frozen pyrochlore ice: proofs on the cells with a coprime pair of extents and on the cells with two chains in every pair of planes, a reduction to Theorem U alone on every cell, and the cubic cells of side one to eight",
  "version": "2026-10-01",
  "date": "2026-10-01",
  "doi": null,
  "sources": {
    "markdown": "notes/theorem-h-orientation.md",
    "pdf": "notes/theorem-h-orientation.pdf",
    "html": "docs/notes/theorem-h-orientation.html",
    "repository": "https://github.com/lyndondrake/ice-mixing-notes"
  },
  "licence": {
    "text": "CC-BY-4.0",
    "code": "MIT",
    "data": "CC0-1.0"
  },
  "authors": [
    "Lyndon Drake"
  ],
  "summary": "Theorem H says that a frozen state of pyrochlore spin ice with a hexagon of odd curl has a dipole axis that is empty or carries one sign only. With Theorem P and Lemma A it gives the periodicity of frozen zero-flux states on every cell whose extents are all at least two. The note proves Theorem H by hand on two infinite families of cells, reduces it on every cell to one statement, Theorem U (an odd frozen state has no unoriented hole), and certifies Theorem U by DRAT proofs on the cubic cells of side four to eight and on four cells that are not cubic. Theorem U is open on the cubic cells of side nine and more. The note also records every route to Theorem U that computation has closed.\n",
  "open_problems": [
    "theorem-h-orientation/thm-u"
  ],
  "claims": [
    {
      "id": "theorem-h-orientation/model",
      "kind": "definition",
      "label": "The model (first section; Holes, cages and rods)",
      "statement": "A cell $(a, b, c)$ of pyrochlore ice is the torus of quarter-cube coordinates modulo $(4a, 4b, 4c)$; its vertices are the sublattice A (even coordinates with sum $0 \\bmod 4$) and B $=$ A $+ (1,1,1)$; each vertex carries four bonds in the directions $d_0, \\dots, d_3$; an ice state gives every bond a direction with two in and two out at every vertex; the dipole moment of a vertex is the sum of its outgoing bond directions and its type is the axis of that moment; a hexagon is the closed walk of six bonds round an octahedral hole determined by two of the four directions; a state is frozen when no hexagon circulates, and (T2) is the matching condition that expresses this in the types; a hexagon's curl is odd or even; an odd state has an odd hexagon; the rods of a hole are the two vertices on its axis with the hole's axis as type, its bridgeheads the four vertices beside them, and a hole is oriented when one rod points towards it and one away.\n",
      "status": "proved",
      "status_detail": "Definitions. Checked for consistency with the simulation code by several independent models, most recently h730_lib (agent pacheck) and h750_model (agent p1check), which agree on the hexagon sets of four cells.",
      "scope": {
        "cells": "every cell"
      },
      "depends_on": [],
      "provenance": {
        "written_by": [
          "Lyndon Drake",
          "Claude (Fable and Opus 5, several agents)"
        ],
        "checked_by": [
          "Claude Opus 5 (agents pacheck, p1check): independent models from the definitions"
        ],
        "human_read": false,
        "date": "2026-10-01"
      }
    },
    {
      "id": "theorem-h-orientation/thm-h",
      "kind": "theorem",
      "label": "Theorem H",
      "statement": "In a frozen state with a hexagon of odd curl, some axis is empty (no vertex has that type) or one-way (every vertex of that type has the same sign of moment).\n",
      "status": "open",
      "status_detail": "Proved on the cells with a coprime pair of extents (Theorem 14), on the cells with two chains in every pair of planes (Theorem 23), and by certificate on the cubic cells of side one to eight and on four cells that are not cubic with their divisors (Theorems 2 and 24). Open elsewhere, where it follows from Theorem U by Theorem 1.",
      "scope": {
        "cells": "every cell; open on the cells with no coprime pair and more than two chains in every pair of planes that are not covered by a certificate, the cubic cells of side nine and more among them",
        "hypotheses": "frozen, odd"
      },
      "depends_on": [
        "theorem-h-orientation/thm-1",
        "theorem-h-orientation/thm-14",
        "theorem-h-orientation/thm-23",
        "theorem-h-orientation/thm-2",
        "theorem-h-orientation/thm-24"
      ],
      "provenance": {
        "written_by": [
          "Lyndon Drake (statement)"
        ],
        "checked_by": [],
        "human_read": false,
        "date": "2026-10-01"
      },
      "notes": "The target statement of the note. Its standing by kind of cell is the table in the note's first section."
    },
    {
      "id": "theorem-h-orientation/thm-u",
      "kind": "conjecture",
      "label": "Theorem U",
      "statement": "In an odd frozen state every octahedral hole is oriented: one of its rods points towards it and the other away. Equivalent forms: an odd state has no charged hole; two consecutive vertices of type $k$ on a $k$-line have the same sign; a state with an unoriented cage has even curl; and the working form (V), that in a state with the four vertices of Theorem U′ the sublattice of the bridgeheads has no vertex of the rods' type.\n",
      "status": "open",
      "status_detail": "Proved on the cells with a coprime pair of extents and on the cells with two chains in every pair of planes; proved for the holes of one axis when the two transverse extents are coprime (Theorem 10) or have greatest common divisor two with the rod axis of odd extent (Theorem 11); certified on the cubic cells of side four to eight and on (3,3,9), (4,4,8), (3,3,12), (6,6,9). Open on every other cell. A whole-torus search for a counterexample on the six cheapest open cells on 2026-10-01 found none, with no near miss.",
      "scope": {
        "cells": "open on cells with no coprime pair of extents and more than two chains in every pair of planes, beyond those certified",
        "hypotheses": "frozen, odd"
      },
      "depends_on": [],
      "provenance": {
        "written_by": [
          "Claude (Fable), main loop (statement, 2026-09-22)"
        ],
        "checked_by": [],
        "human_read": false,
        "date": "2026-10-01"
      },
      "notes": "The one open statement between the record and Theorem H on every cell, and so between the record and the periodicity of frozen zero-flux states. Everything known about it is in the note's section \"Theorem U\", items 1 to 9, including the routes computation has closed; see the negative-result claims of this manifest.\n"
    },
    {
      "id": "theorem-h-orientation/thm-1",
      "kind": "theorem",
      "label": "Theorem 1 (the reduction), form of 30 September 2026, with Lemmas 22 to 25",
      "statement": "On every cell, Theorem U implies Theorem H.",
      "status": "proved",
      "status_detail": "Written argument: with every hole oriented, Theorem 6 makes the line count of a two-way type a function of one transverse coordinate on each sublattice, Theorem 3 makes the two sublattices share that coordinate, Theorem 15 kills one profile per two-way axis so that with three two-way axes some axis has a constant line count on both sublattices, and the diagonal law along the connected graph of lines makes that axis one-way. Re-derived by the main loop, then read by an independent checker with its own programs (agent check10), which confirmed it with five corrections of wording and no gap; its one prediction about odd states tested on the corpus with no exception.",
      "scope": {
        "cells": "every cell",
        "hypotheses": "frozen, odd, every hole oriented (which Theorem U supplies)"
      },
      "depends_on": [
        "theorem-h-orientation/thm-m-prime",
        "theorem-h-orientation/cage-laws",
        "theorem-h-orientation/thm-3-diagonal-law",
        "theorem-h-orientation/thm-6-separability",
        "theorem-h-orientation/thm-15",
        "theorem-h-orientation/parametrisation-c",
        "theorem-h-orientation/lemma-21"
      ],
      "supersedes": "theorem-h-orientation/thm-1-first-form",
      "provenance": {
        "written_by": [
          "Claude Fable 5.1 (agent zeroflux)"
        ],
        "checked_by": [
          "Claude Opus 5 (agent check10), own programs"
        ],
        "cross_checks": [
          "Claude Fable 5.1 (main loop): re-derivation from the cited theorems; corpus checks re-run with 0 violations"
        ],
        "human_read": false,
        "date": "2026-09-30",
        "log": "LOG.md, entries of 2026-09-30 (zeroflux, check10)"
      },
      "artefacts": [
        {
          "kind": "report",
          "path": "reports/2026-09-30-fable-zeroflux.md"
        },
        {
          "kind": "report",
          "path": "reports/2026-09-30-opus-check10.md"
        },
        {
          "kind": "script",
          "path": "private:experiments/08_frozen_structure/scratch_h/h600_stripes.py",
          "note": "scripts h600 to h605 (author) and h670 to h672 (checker)"
        }
      ]
    },
    {
      "id": "theorem-h-orientation/thm-1-first-form",
      "kind": "theorem",
      "label": "Theorem 1, first form (27 September 2026), through K_u",
      "statement": "On every cell on which K_u holds for uniform chains of all three axes, Theorem U implies Theorem H.",
      "status": "proved",
      "status_detail": "The earlier proof, kept under its own heading in the note's section 'Proof of Theorem 1'. Read by independent checkers (agents check, check2) on 27 September. Replaced as the route to Theorem H by the form of 30 September, which needs no K_u.",
      "scope": {
        "cells": "every cell on which K_u holds for all three axes",
        "hypotheses": "frozen, odd, every hole oriented"
      },
      "depends_on": [
        "theorem-h-orientation/ku",